{
  "kind": "bibleapp:distribution-manifest",
  "schema_version": 1,
  "distribution_id": "full-study-bundled-v1",
  "physical_data_mode": "bundled_static_data",
  "complete_offline": true,
  "bundled_fallback": true,
  "package_manifest": {
    "path": "data/package-manifest.json",
    "schema_version": 1,
    "package_id": "reader-texts",
    "content_sha256": "sha256:5407048f224adc0a5c27051882b87ab02c119e13c228bbd047a8b2d31dacf55c"
  },
  "bundled_package_ids": [
    "reader-texts"
  ],
  "immutable_base_feature_pack_ids": [],
  "managed_optional_pack_ids": [
    "search-verses",
    "commentary-verse-index"
  ],
  "catalog": null,
  "note": "The tracked public preview remains a complete bundled offline distribution. Managed physical packs are an opt-in reference mode and do not replace bundled data in this branch."
}
